{
  "schema": 1,
  "targetUiVersion": "1.4",
  "id": "ui-capabilities",
  "title": "Salamatrix UI capabilities",
  "width": 463,
  "height": 236,
  "controls": [
    { "kind": "groupbox", "id": "static-group", "text": "CGUIStaticTextAbstract", "bounds": { "x": 6, "y": 4, "width": 254, "height": 108 }, "options": {} },
    { "kind": "label", "id": "not-attached-label", "text": "Not attached static text", "bounds": { "x": 14, "y": 17, "width": 80, "height": 8 }, "options": {} },
    { "kind": "label", "id": "uptime-plain", "text": "System was started 110597484 ms ago.", "bounds": { "x": 102, "y": 17, "width": 152, "height": 8 }, "options": {} },
    { "kind": "label", "id": "static-none-label", "text": "0 (no flags)", "bounds": { "x": 14, "y": 27, "width": 75, "height": 8 }, "options": {} },
    { "kind": "statictext", "id": "static-none", "text": "System was started 110597484 ms ago.", "bounds": { "x": 102, "y": 27, "width": 152, "height": 8 }, "options": { "styleFlags": 0 } },
    { "kind": "label", "id": "static-cache-label", "text": "STF_CACHED_PAINT", "bounds": { "x": 14, "y": 37, "width": 75, "height": 8 }, "options": {} },
    { "kind": "statictext", "id": "static-cache", "text": "System was started 110597484 ms ago.", "bounds": { "x": 102, "y": 37, "width": 152, "height": 8 }, "options": { "styleFlags": 1 } },
    { "kind": "label", "id": "static-bold-label", "text": "STF_BOLD", "bounds": { "x": 14, "y": 47, "width": 75, "height": 8 }, "options": {} },
    { "kind": "statictext", "id": "static-bold", "text": "Bold &text", "bounds": { "x": 102, "y": 47, "width": 152, "height": 8 }, "options": { "styleFlags": 65666 } },
    { "kind": "label", "id": "static-underline-label", "text": "STF_UNDERLINE", "bounds": { "x": 14, "y": 56, "width": 75, "height": 8 }, "options": {} },
    { "kind": "statictext", "id": "static-underline", "text": "Underlined text", "bounds": { "x": 102, "y": 56, "width": 152, "height": 8 }, "options": { "styleFlags": 131076 } },
    { "kind": "label", "id": "static-end-label", "text": "STF_END_ELLIPSIS", "bounds": { "x": 14, "y": 66, "width": 75, "height": 8 }, "options": {} },
    { "kind": "statictext", "id": "static-end", "text": "Long long long long long long long long long string.", "bounds": { "x": 102, "y": 66, "width": 152, "height": 8 }, "options": { "styleFlags": 32 } },
    { "kind": "label", "id": "static-path-label", "text": "STF_PATH_ELLIPSIS", "bounds": { "x": 14, "y": 76, "width": 75, "height": 8 }, "options": {} },
    { "kind": "statictext", "id": "static-path", "text": "C:\\Program Files\\Some Application With Long Path\\example.exe", "bounds": { "x": 102, "y": 76, "width": 152, "height": 8 }, "options": { "styleFlags": 64 } },
    { "kind": "label", "id": "static-path-url-label", "text": "STF_PATH_ELLIPSIS", "bounds": { "x": 14, "y": 87, "width": 75, "height": 8 }, "options": {} },
    { "kind": "statictext", "id": "static-path-url", "text": "ftp://ftp.altap.cz/pub/salamander/example.exe", "bounds": { "x": 102, "y": 87, "width": 152, "height": 8 }, "options": { "styleFlags": 64, "pathSeparator": "/" } },
    { "kind": "label", "id": "drag-hint", "text": "Drag texts to change their size.", "bounds": { "x": 151, "y": 97, "width": 103, "height": 8 }, "options": {} },
    { "kind": "groupbox", "id": "progress-group", "text": "CGUIProgressBarAbstract", "bounds": { "x": 6, "y": 118, "width": 254, "height": 66 }, "options": {} },
    { "kind": "label", "id": "progress-label", "text": "Progress label", "bounds": { "x": 15, "y": 129, "width": 60, "height": 8 }, "options": {} },
    { "kind": "progressbar", "id": "progress", "text": "", "bounds": { "x": 15, "y": 138, "width": 235, "height": 12 }, "options": { "progress": 120 } },
    { "kind": "label", "id": "unknown-label", "text": "Unknown progress", "bounds": { "x": 15, "y": 154, "width": 67, "height": 8 }, "options": {} },
    { "kind": "progressbar", "id": "unknown-progress", "text": "", "bounds": { "x": 15, "y": 163, "width": 235, "height": 12 }, "options": { "progress": -1, "indeterminateDuration": -1, "indeterminateInterval": 100 } },
    { "kind": "groupbox", "id": "buttons-group", "text": "Button, CGUITextArrowButtonAbstract, CGUIColorArrowButtonAbstract", "bounds": { "x": 6, "y": 188, "width": 254, "height": 40 }, "options": {} },
    { "kind": "button", "id": "more", "text": "...", "bounds": { "x": 15, "y": 204, "width": 15, "height": 14 }, "options": { "keepOpen": true } },
    { "kind": "arrowbutton", "id": "arrow", "text": "", "bounds": { "x": 37, "y": 204, "width": 15, "height": 14 }, "options": {} },
    { "kind": "textarrowbutton", "id": "choose", "text": "&Choose", "bounds": { "x": 60, "y": 204, "width": 50, "height": 14 }, "options": { "styleFlags": 8 } },
    { "kind": "textarrowbutton", "id": "drop", "text": "&Drop", "bounds": { "x": 117, "y": 204, "width": 50, "height": 14 }, "options": { "styleFlags": 2 } },
    { "kind": "colorarrowbutton", "id": "color", "text": "", "bounds": { "x": 174, "y": 204, "width": 33, "height": 14 }, "options": { "textColor": 16744448, "backgroundColor": 16744448 } },
    { "kind": "colorarrowbutton", "id": "color-text", "text": "ABC", "bounds": { "x": 215, "y": 204, "width": 33, "height": 14 }, "options": { "textColor": 0, "backgroundColor": 65535 } },
    { "kind": "groupbox", "id": "hyperlink-group", "text": "CGUIHyperLinkAbstract", "bounds": { "x": 269, "y": 4, "width": 185, "height": 48 }, "options": {} },
    { "kind": "label", "id": "open-label", "text": "SetActionOpen", "bounds": { "x": 277, "y": 17, "width": 75, "height": 8 }, "options": {} },
    { "kind": "hyperlink", "id": "open-link", "text": "www.altap.cz", "bounds": { "x": 365, "y": 17, "width": 47, "height": 8 }, "options": { "styleFlags": 20, "actionOpen": "https://www.altap.cz" } },
    { "kind": "label", "id": "command-label", "text": "SetActionPostCommand", "bounds": { "x": 277, "y": 27, "width": 81, "height": 8 }, "options": {} },
    { "kind": "hyperlink", "id": "command-link", "text": "Say something!", "bounds": { "x": 365, "y": 27, "width": 55, "height": 8 }, "options": { "styleFlags": 20, "actionCommand": 32513 } },
    { "kind": "label", "id": "hint-label", "text": "SetActionShowHint", "bounds": { "x": 277, "y": 37, "width": 81, "height": 8 }, "options": {} },
    { "kind": "hyperlink", "id": "hint-link", "text": "mask hints", "bounds": { "x": 365, "y": 37, "width": 40, "height": 8 }, "options": { "styleFlags": 8, "actionHint": "text 1 text 1 text 1 text 1\ntext 2 text 2 text 2" } },
    { "kind": "groupbox", "id": "tooltip-group", "text": "SetCurrentToolTip", "bounds": { "x": 269, "y": 59, "width": 185, "height": 31 }, "options": {} },
    { "kind": "statictext", "id": "tooltip", "text": "Pause the mouse pointer over this text.", "bounds": { "x": 278, "y": 73, "width": 130, "height": 8 }, "options": { "styleFlags": 262144, "toolTip": "ToolTip" } },
    { "kind": "listview", "id": "header-list", "text": "", "bounds": { "x": 269, "y": 113, "width": 185, "height": 50 }, "options": { "styleFlags": 31457280 } },
    { "kind": "toolbarheader", "id": "toolbar-header", "text": "CGUIToolbarHeaderAbstract", "bounds": { "x": 269, "y": 102, "width": 96, "height": 8 }, "options": { "alignControlId": "header-list", "buttonMask": 49 } },
    { "kind": "groupbox", "id": "origin-group", "text": "Created by", "bounds": { "x": 269, "y": 169, "width": 185, "height": 38 }, "options": {} },
    { "kind": "label", "id": "runtime-label", "text": "Runtime:", "bounds": { "x": 277, "y": 181, "width": 42, "height": 8 }, "options": {} },
    { "kind": "statictext", "id": "runtime-value", "text": "PowerShell", "bounds": { "x": 323, "y": 181, "width": 122, "height": 8 }, "options": { "styleFlags": 2 } },
    { "kind": "label", "id": "extension-label", "text": "Extension:", "bounds": { "x": 277, "y": 192, "width": 42, "height": 8 }, "options": {} },
    { "kind": "statictext", "id": "extension-value", "text": "Salamatrix Studio UI Capabilities Demo", "bounds": { "x": 323, "y": 192, "width": 122, "height": 8 }, "options": { "styleFlags": 2 } },
    { "kind": "button", "id": "close", "text": "Close", "bounds": { "x": 403, "y": 213, "width": 50, "height": 14 }, "options": { "dialogResult": 1, "styleFlags": 1048576 } }
  ]
}
